{
  "baseBranch": "fix/device-link-recovery-20261004",
  "baseRevision": "421f45f610eb16c2a85ec2920963101c9065fd22",
  "branch": "obv/products-l3-benchmark-data-attribution-20261010",
  "repo": "SamGu-NRX/CogPortal",
  "resources": [
    {
      "attribution": {
        "evidenceState": "unknown",
        "statement": "Committed metadata pins this submodule at 4e516f39ffbeefe579e093260b2865eb354c17a7 via the parent gitlink."
      },
      "declaredBy": [
        ".gitmodules"
      ],
      "entryPoints": [
        {
          "evidenceState": "verified",
          "path": "benchmarks/week1/audio_identification_benchmark/datasets.py",
          "role": "corpus generator"
        },
        {
          "evidenceState": "verified",
          "path": "benchmarks/week1/audio_identification_benchmark/manifests/public-test.json",
          "role": "committed corpus manifest"
        },
        {
          "evidenceState": "verified",
          "path": "benchmarks/week1/audio_identification_benchmark/manifests/public-evaluation.json",
          "role": "committed corpus manifest"
        }
      ],
      "id": "benchmarks-week1-submodule",
      "kind": "code-submodule",
      "label": "Week 1 audio identification benchmark (pinned submodule)",
      "notes": "No LICENSE file was found at the checked-out revision of this submodule; recorded as unknown, not guessed.",
      "reuse": {
        "evidenceState": "unknown",
        "noticeReferences": []
      },
      "source": {
        "evidenceState": "verified",
        "pin": "4e516f39ffbeefe579e093260b2865eb354c17a7",
        "pinSource": "benchmarks/week1 gitlink",
        "urls": [
          "https://github.com/SamGu-NRX/cogworks-week1-audio-benchmark.git"
        ]
      },
      "sourceGroup": "pinned-submodule",
      "version": "4e516f39ffbeefe579e093260b2865eb354c17a7"
    },
    {
      "attribution": {
        "evidenceState": "verified",
        "statement": "Committed metadata pins this submodule at a3dd948d0c108fabf070b4f159acdecd4d6c3897 via the parent gitlink; its committed LICENSE states a copyright line."
      },
      "declaredBy": [
        ".gitmodules"
      ],
      "entryPoints": [
        {
          "evidenceState": "verified",
          "path": "benchmarks/week2/facial_recognition_benchmark/datasets.py",
          "role": "dataset loader"
        },
        {
          "evidenceState": "verified",
          "path": "benchmarks/week2/facial_recognition_benchmark/model-lock.json",
          "role": "model pin"
        },
        {
          "evidenceState": "verified",
          "path": "benchmarks/week2/facial_recognition_benchmark/manifests/public-test.json",
          "role": "committed dataset manifest"
        },
        {
          "evidenceState": "verified",
          "path": "benchmarks/week2/facial_recognition_benchmark/manifests/public-evaluation.json",
          "role": "committed dataset manifest"
        }
      ],
      "id": "benchmarks-week2-submodule",
      "kind": "code-submodule",
      "label": "Week 2 facial recognition benchmark (pinned submodule)",
      "notes": "Dataset terms are referenced by the committed data-and-scoring document, which points to the CelebA agreement and Hugging Face terms without reproducing them.",
      "reuse": {
        "evidenceState": "verified",
        "noticeReferences": [
          {
            "evidenceState": "verified",
            "path": "benchmarks/week2/LICENSE",
            "quote": "Copyright (c) 2026 Reynaldo Jose Morillo Nolasco",
            "relationship": "upstream-license"
          },
          {
            "evidenceState": "secondary",
            "path": "benchmarks/week2/docs/data-and-scoring.md",
            "quote": "CelebA files are not redistributed and remain subject to the [CelebA agreement]",
            "relationship": "terms-pointer"
          }
        ]
      },
      "source": {
        "evidenceState": "verified",
        "pin": "a3dd948d0c108fabf070b4f159acdecd4d6c3897",
        "pinSource": "benchmarks/week2 gitlink",
        "urls": [
          "https://github.com/SamGu-NRX/cogworks-week2-vision-benchmark.git"
        ]
      },
      "sourceGroup": "pinned-submodule",
      "version": "a3dd948d0c108fabf070b4f159acdecd4d6c3897"
    },
    {
      "attribution": {
        "evidenceState": "verified",
        "statement": "Committed metadata pins this submodule at 4b1755433110b387b8a37021ef173300636d3b8c via the parent gitlink."
      },
      "declaredBy": [
        ".gitmodules"
      ],
      "entryPoints": [
        {
          "evidenceState": "verified",
          "path": "benchmarks/week3/language_search_benchmark/datasets.py",
          "role": "artifact table"
        }
      ],
      "id": "benchmarks-week3-submodule",
      "kind": "code-submodule",
      "label": "Week 3 language search benchmark (pinned submodule)",
      "notes": "A LICENSE file is committed at the checked-out revision.",
      "reuse": {
        "evidenceState": "verified",
        "noticeReferences": [
          {
            "evidenceState": "verified",
            "path": "benchmarks/week3/LICENSE",
            "quote": "Copyright (c) 2026 Sam Gu",
            "relationship": "upstream-license"
          }
        ]
      },
      "source": {
        "evidenceState": "verified",
        "pin": "4b1755433110b387b8a37021ef173300636d3b8c",
        "pinSource": "benchmarks/week3 gitlink",
        "urls": [
          "https://github.com/SamGu-NRX/cogworks-week3-language-benchmark.git"
        ]
      },
      "sourceGroup": "pinned-submodule",
      "version": "4b1755433110b387b8a37021ef173300636d3b8c"
    },
    {
      "attribution": {
        "evidenceState": "verified",
        "statement": "The committed model-lock.json records a URL and a sha256 for this checkpoint."
      },
      "declaredBy": [
        "benchmarks/week2/facial_recognition_benchmark/model-lock.json"
      ],
      "entryPoints": [
        {
          "evidenceState": "verified",
          "path": "benchmarks/week2/facial_recognition_benchmark/model-lock.json",
          "role": "pin file"
        }
      ],
      "id": "week2-facenet-checkpoint",
      "kind": "model-checkpoint",
      "label": "FaceNet model checkpoint pinned by week2",
      "notes": "No reuse notice for this checkpoint was found in the committed metadata; recorded as unknown, not guessed.",
      "reuse": {
        "evidenceState": "unknown",
        "noticeReferences": []
      },
      "source": {
        "evidenceState": "verified",
        "pin": "281cebca8662831adb987a874bdcb36e73f5b1c6dc5ee5878f305e985625d99b",
        "pinSource": "benchmarks/week2/facial_recognition_benchmark/model-lock.json checkpoint.sha256",
        "urls": [
          "https://github.com/timesler/facenet-pytorch/releases/download/v2.2.9/20180402-114759-vggface2.pt"
        ]
      },
      "sourceGroup": "pinned-submodule",
      "version": "281cebca8662831adb987a874bdcb36e73f5b1c6dc5ee5878f305e985625d99b"
    },
    {
      "attribution": {
        "evidenceState": "verified",
        "statement": "The committed datasets.py records this artifact's size, sha256, and URL for release https://github.com/rsokl/cog_data/releases/download/language-files/."
      },
      "declaredBy": [
        "benchmarks/week3/language_search_benchmark/datasets.py"
      ],
      "entryPoints": [
        {
          "evidenceState": "verified",
          "path": "benchmarks/week3/language_search_benchmark/datasets.py",
          "role": "artifact table"
        }
      ],
      "id": "week3-coco-captions",
      "kind": "dataset",
      "label": "COCO captions_train2014.json",
      "notes": "No reuse notice for this artifact was found in the committed metadata; recorded as unknown, not guessed.",
      "reuse": {
        "evidenceState": "unknown",
        "noticeReferences": []
      },
      "source": {
        "evidenceState": "verified",
        "pin": "dd8c9636dc11740f956e36728866ea0c4ebe4988dcbdc5e712b7c2267f152d12",
        "pinSource": "benchmarks/week3/language_search_benchmark/datasets.py ARTIFACTS.captions.sha256",
        "urls": [
          "https://github.com/rsokl/cog_data/releases/download/language-files/captions_train2014.json",
          "https://www.dropbox.com/s/0e4fpk8wppyojyk/captions_train2014.json?dl=1"
        ]
      },
      "sourceGroup": "pinned-submodule",
      "version": "https://github.com/rsokl/cog_data/releases/download/language-files/"
    },
    {
      "attribution": {
        "evidenceState": "verified",
        "statement": "The committed datasets.py records this artifact's size, sha256, and URL for release https://github.com/rsokl/cog_data/releases/download/language-files/."
      },
      "declaredBy": [
        "benchmarks/week3/language_search_benchmark/datasets.py"
      ],
      "entryPoints": [
        {
          "evidenceState": "verified",
          "path": "benchmarks/week3/language_search_benchmark/datasets.py",
          "role": "artifact table"
        }
      ],
      "id": "week3-resnet-features",
      "kind": "dataset",
      "label": "resnet18_features.pkl",
      "notes": "No reuse notice for this artifact was found in the committed metadata; recorded as unknown, not guessed.",
      "reuse": {
        "evidenceState": "unknown",
        "noticeReferences": []
      },
      "source": {
        "evidenceState": "verified",
        "pin": "d56e267dacd39608b4aae581595f8fa8ec55457ab59b713df1eafa93e1023450",
        "pinSource": "benchmarks/week3/language_search_benchmark/datasets.py ARTIFACTS.descriptors.sha256",
        "urls": [
          "https://github.com/rsokl/cog_data/releases/download/language-files/resnet18_features.pkl",
          "https://www.dropbox.com/s/5gklm1ar3tz84rm/resnet18_features.pkl?dl=1"
        ]
      },
      "sourceGroup": "pinned-submodule",
      "version": "https://github.com/rsokl/cog_data/releases/download/language-files/"
    },
    {
      "attribution": {